,Instructions:,,,,,,,,,,,,,,,,,,,,,,,,,,,
317,37,2025/09/09,IM,Project Palladium,Carl Rosén,Svenska Spels Förvaltnings AB,Cushman & Wakefield,Sweden,Stockholm,No,"Kungsgatan 65, Stockholm",–,Stockholm Hasseln 1,Mixed Use,"6,454",–,–,-,–,0%,–,,-,"Historic landmark building originally developed as Stockholm’s largest cinema and later converted to a casino. Currently vacant, the asset offers flexible layouts, prime CBD location at Vasagatan/Kungsgatan, and strong potential for repositioning into office, hospitality, or mixed-use concepts.",,,,
318,37,2025/09/09,IM,Librobäck,Filip Gustavsson,Menir Fastigheter Uppsala AB,Forum Fastighetsekonomi,Sweden,Uppsala,Yes,Hållnäsgatan 13,752 28,Librobäck 17:6,Industrial,925,"1,225","958,223","1,036",,89%,,,-,"Portfolio of two modern industrial/office properties in Librobäck, Uppsala, both ~5 km from central city. Combined leasable area ~2,300 sqm. Tenants include Statens Historiska Museer (government) and local industrial users. Properties in normal condition with stable cash flows.",,,,
318,37,2025/09/09,IM,Librobäck,Filip Gustavsson,Menir Fastigheter Uppsala AB,Forum Fastighetsekonomi,Sweden,Uppsala,Yes,Hållnäsgatan 11,752 28,Librobäck 17:5,Industrial,"1,356","1,016","1,200,907",886,,100%,,,-,"Portfolio of two modern industrial/office properties in Librobäck, Uppsala, both ~5 km from central city. Combined leasable area ~2,300 sqm. Tenants include Statens Historiska Museer (government) and local industrial users. Properties in normal condition with stable cash flows.",,,,
319,37,2025/09/09,IM,Projekt Smörgatan,Josefin Bergholtz,Kommanditbolaget Smörkallen,Cushman & Wakefield,Sweden,Göteborg,No,Smörgatan 106,412 76,Skår 59:1,Residential,"3,042","2,107","5,160,000","1,696",,100%,,,-,"Modern residential property built 2009 in Kallebäck, Göteborg with 47 apartments (38 regular, 9 BmSS). Includes block lease to Göteborgs Stad for BmSS and antenna contract with Telia. Strong residential location near Korsvägen and Delsjön, stable fully let asset with 28 parking spaces.",,,,
320,37,2025/09/09,IM,Project Gateway (2),David Hävermark,Ragde Eiendom AS,Colliers Project Finance / Propcap,Norway,Oslo,Yes,,,"Brobekkveien 80, Alf Bjerckes vei 10 og 14",Mix Use,"79,514","1,839",,-,7,96%,6%,,-,"A last-mile logistics and wholesale cluster of ~80,000 sqm leasable area, strategically located at Alnabruterminalen in Oslo’s Groruddalen. Anchored by tenants Duri Fagprofil (13,291 sqm, 22.4m NOK rent) and Storcash (10,524 sqm, 19.8m NOK rent). Strong demand drivers with upside from lease reversion, vacancy lease-up (~3,025 sqm vacant), and identified development projects. Net NOI 148.8m NOK (2026E, total).",,,,
321,37,2025/09/10,Teaser,Halmstad Portfolio,David Hävermark,Willhem AB,Catella,Sweden,Halmstad,Yes,"Domherren 6 & 7, Hästmöllan 19, Kronofogden 3, Lövsmygen 8",,"Domherren 6 & 7, Hästmöllan 19, Kronofogden 3, Lövsmygen 8",Residential,"1,732","1,443","1,600,000",924,,,,,-,"A portfolio of 5 centrally located residential properties in Halmstad with total 22 apartments. Combined rental income of c. 2.5m SEK, NOI 1.6m SEK. Properties are well-maintained with potential for standard upgrades and future conversion to condominiums.",,,,
322,37,2025/09/10,Teaser,Eskilstuna Portfolio,Filip Gustavsson,HSB Sörmlandsbostäder AB,BLOKK,Sweden,Eskilstuna,Yes,"Nejonögat 6, Sånglärkan 1, Stövaren 1, Smeden 3, Färgaren 17 & 18, Svalan 32 & 33, Timjan 12 & 13",,,Residential,"6,397","1,405",,-,,,,,-,"A consolidated residential portfolio of 10 buildings totaling 97 apartments (~6,400 BOA + 1,400 LOA). Centrally located with stable cash flows. NOI is ~6,500,000 (total rent value (resi+parking+retail) ~10m – costs ~3.5m).",,,,
323,37,2025/09/10,IM,Kopparcronan,Albin Östmarck,Kopparcronan AB,New Property,Sweden,Täby,Yes,Enhagsvägen 12,,Förgasaren 4,Commercial,262,"9,151","2,366,000","9,031",,100%,,,-,"Portfolio of 7 properties in Stockholm suburbs (Täby, Haninge, Huddinge, Lidingö). Anchored by strong tenants including Ahlsell, Ramirent, Preem, and Lixon Holding. Good transport connectivity and strategic industrial locations.",,,,
323,37,2025/09/10,IM,Kopparcronan,Albin Östmarck,Kopparcronan AB,New Property,Sweden,Haninge,Yes,Vendelsövägen 19,,Söderbymalm 3:330,Commercial,"2,649","5,016","4,751,000","1,794",,100%,,,-,"Portfolio of 7 properties in Stockholm suburbs (Täby, Haninge, Huddinge, Lidingö). Anchored by strong tenants including Ahlsell, Ramirent, Preem, and Lixon Holding. Good transport connectivity and strategic industrial locations.",,,,
323,37,2025/09/10,IM,Kopparcronan,Albin Östmarck,Kopparcronan AB,New Property,Sweden,Haninge,Yes,Träffgatan 1,,Söderby 1:816,Commercial,929,"1,297","791,000",851,,100%,,,-,"Portfolio of 7 properties in Stockholm suburbs (Täby, Haninge, Huddinge, Lidingö). Anchored by strong tenants including Ahlsell, Ramirent, Preem, and Lixon Holding. Good transport connectivity and strategic industrial locations.",,,,
323,37,2025/09/10,IM,Kopparcronan,Albin Östmarck,Kopparcronan AB,New Property,Sweden,Huddinge,Yes,Svarvarvägen 3B,,Svarven 8,Commercial,450,"3,023","1,311,000","2,913",,100%,,,-,"Portfolio of 7 properties in Stockholm suburbs (Täby, Haninge, Huddinge, Lidingö). Anchored by strong tenants including Ahlsell, Ramirent, Preem, and Lixon Holding. Good transport connectivity and strategic industrial locations.",,,,
323,37,2025/09/10,IM,Kopparcronan,Albin Östmarck,Kopparcronan AB,New Property,Sweden,Lidingö,Yes,Herserudsvägen 83 / Södra Kungsvägen 84,,"Bensinmacken 1, Lidingö 8:124, 8:125",Commercial,"1,728","2,843","714,000",413,,100%,,,-,"Portfolio of 7 properties in Stockholm suburbs (Täby, Haninge, Huddinge, Lidingö). Anchored by strong tenants including Ahlsell, Ramirent, Preem, and Lixon Holding. Good transport connectivity and strategic industrial locations.",,,,
324,37,2025/09/10,Teaser,Kølholt Vejle V,Kristina Alderin,,Colliers,Denmark,Vejle,No,,"7,100",,Residential,"16,750","1,410","20,310,900","1,213",,,5%,"  420,000,000 ","25,075","Planned residential area in Vejle with 165 units (107 units are one story terraced houses and 58 are two story terraced houses). Includes landscaped green areas, ponds, and parking. Early-stage project with site plan approved; financials driven by future rental income once built.",,,,
325,37,2025/09/10,Teaser,Project Nordhaven,Mathias Vuorelma,Ilmarinen Mutual Pension Insurance Company,Newsec Advisory Finland,Finland,Helsinki,Yes,,,,Residential,"54,133",,"8,163,000",151,,94%,,,-,"Large-scale residential portfolio with 999 apartments across 13 assets in Helsinki metro. Leasable area is 54,133sqm total (53,526 resi + 586 comm). €9.2m fully-let NOI (2026), €8.2m current NOI, €11.7m potential NOI.  Strong fundamentals with 99.9% rent collection, 27% churn, and value-add potential from rent uplift (+6%), refurbishments (+21%), and ESG upgrades. Clear roadmap to EU taxonomy compliance (A–C EPC). Portfolio strategically located near rail links (86% of NOI within walking distance).",,,,
326,37,2025/09/11,Teaser,Project Alice (2),Carl Rosén,,JLL,Sweden,Stockholm,No,,,,Public Use,,,"54,000,000",-,19,100%,,,-,"Newly built in 2024 in Liljeholmen, Stockholm. Tenants are Internationella Engelska Skolan and City of Stockholm, both on 20-year CPI-indexed leases with municipal guarantee. Facility includes school for 1,200+ students and Stockholm’s largest sports facility with 20,000 annual hours.",,,,
327,37,2025/09/11,Teaser,Project Mermaid,Johan Onsjö,Weinert Holding,JLL,Various,Various,Yes,,,,Hotels,,,,-,,,,,-,"Portfolio of 10 lifestyle hotels across Denmark, Germany, and Norway. Includes 928 keys in Denmark, 403 in Germany, and 49 in Norway. Anchored by Copenhagen with pipeline projects in Aarhus and Hamburg. Strong brand in sustainable hospitality.",,,,
328,37,2025/09/11,Teaser,Spånga – Flysta,Filip Gustavsson,Tibur Property AB,Bjurfors Näringsliv,Sweden,Stockholm,Yes,Långvretsvägen 53,163 46,Tiburtius 13,Residential,"1,416","1,675","2,099,083","1,482",,100%,,,-,"Two multi-family residential properties in Flysta, Spånga. A total of 23 apartments (1,181 sqm) and 3 premises/storage units (235 sqm) on a freehold plot of 3,041 sqm. Built in 1947–49, with ongoing renovations (roof, plumbing, geothermal heating, solar panels, windows). Possible building rights between the houses. Located in a residential neighborhood close to public transport and Palmérs Park.",,,,
328,37,2025/09/11,Teaser,Spånga – Flysta,Filip Gustavsson,Tibur Property AB,Bjurfors Näringsliv,Sweden,Stockholm,Yes,Lindalsvägen 24,163 46,Tiburtius 14,,,,,-,,,,,-,"Two multi-family residential properties in Flysta, Spånga. A total of 23 apartments (1,181 sqm) and 3 premises/storage units (235 sqm) on a freehold plot of 3,041 sqm. Built in 1947–49, with ongoing renovations (roof, plumbing, geothermal heating, solar panels, windows). Possible building rights between the houses. Located in a residential neighborhood close to public transport and Palmérs Park.",,,,
329,37,2025/09/11,Teaser,Vigerslev Stationstorv,Anthony Romano,RSP Partnership A/S,Colliers,Denmark,Copenhagen,No,,,,Residential,"22,100",,,-,,,,,-,"Residential-led development in Valby with ~22,100 sqm build rights. Plan includes ~2,950 sqm retail (two supermarkets with long pre-contracts), 6,050 sqm student housing, 5,550 sqm non-profit assisted living, and 7,550 sqm family housing. Attractive location by Vigerslev S-train station, next to Grønttorvet development.",,,,
330,37,2025/09/11,Teaser,Egeparken,Kristina Alderin,Ejendomsselskabet Egeparkshusene ApS,EDC Erhverv Poul Erik Bech,Denmark,Fredensborg,No,"Egeparken 1–112, Brønsholm By, Karlebo","2,980",Egeparken 1–112,Residential,"11,136","1,632","15,727,167","1,412",,100%,5%,"  370,000,000 ","33,226","Modern residential rental property built 2008–2018 with 112 apartments and 2 commercial units. Avg. unit size 97 sqm with balconies/terraces, strong location in green setting. Fully let, NOI ~15.7m DKK, priced at 370m DKK (yield 4.53%).",,,,
331,37,2025/09/11,Teaser,Selmedalsvägen 78,Filip Gustavsson,,Bjurfors,Sweden,Stockholm,No,Selmedalsvägen 78,,Förgyllda Bägaren 1,Residential,"5,025",,,-,,,,"  190,000,000 ","37,811","Residential property in Hägersten with 61 units totaling 5,025 sqm BOA. Offered at an asking price of 190m SEK.",,,,
332,37,2025/09/11,Teaser,Nyponvägen 9,Filip Gustavsson,,Länsförsäkringar Fastighetsförmedling,Sweden,Vallentuna,No,Nyponvägen 9 m.fl,,"Ormsta 1:252, 1:1090, 1:1091, 1:1092",Residential,"3,457",,,-,,,,"  11,000,000 ","3,182","Four building-ready plots in Ormsta, Vallentuna, totaling 3,457 sqm. Approved detailed plan with municipal water/sewage connection. Asking price 11m SEK. Suitable for parhus/newbuild project in established residential area with good communications.",-,-,,
334,38,2025/09/12,IM,Projekt Mantorp,David Hävermark,Eiendoms Compagniet Sverige AB,Newsec Advisory,Sweden,Mjölby,No,Viby 12:22,,Viby 12:22,Retail,"19,910",826,"7,733,000",388,,75%,,,-,"Depot Mantorp is a major retail destination along E4 with City Gross as anchor tenant (73% of rental income, lease to 2031). Includes 11 tenants such as Kronans Apotek, Team Sportia, Instabox. Features Sweden’s largest Tesla Supercharger station (40 stalls, +20 contracted). Large expansion potential (40,000 sqm build rights). Recently refurbished (2013, 2023–24). Est. NOI 2025 is 7,733 TSEK and fully rented Est. NOI 2025 is 14,200 TSEK.",,,,
335,38,2025/09/12,IM,Project Solkvarteret,Josefin Bergholtz,NordLo Fastigheter AB,JLL,Sweden,Malmö,No,Skuren 1,,Malmö Skuren 1,Residential,"4,204","2,060","8,801,898","2,094",,100%,,,-,"Prime residential asset in Hyllie, Malmö. Two newly built buildings (2022) with 85 modern rental apartments, one commercial unit (55 sqm), and parking rights (41 spaces). Certified FEBY Gold & EPC B, with solar panels and smart energy solutions. NOI ~8.8m SEK (2026E). Excellent commuter location 500m from Hyllie station, 8 min to Malmö C and 12 min to Copenhagen Airport.",,,,
336,38,2025/09/15,Teaser,Projekt Faxholm,Erik Widmark,Willhem Fastigheter Helsingborg AB,Croisette / Knight Frank,Sweden,Helsingborg,Yes,"Ösögatan 25 & 13, Holmgårdsgatan 79, 101, 99, 51",,"Granholmen 164, 170; Skinfaxe 14, 21, 22, 26",Residential,503,"1,455","470,000",934,,,,,-,"Portfolio of six residential terraced houses in Rydebäck/Sydvästra Ättekulla, Helsingborg. Built 1990–91, total BOA 503 sqm. Fully let with NOI ~470k SEK, stable single-family housing stock, modern heating systems, and good residential location close to transport and amenities.",,,,
337,38,2025/09/15,Teaser,Projekt Pyran,Erik Widmark,Willhem Fastigheter Helsingborg AB,Croisette / Knight Frank,Sweden,Helsingborg,No,"Furutorpsgatan 53–57, Magistergatan 5",,Myran 2,Residential,"2,764","1,585","3,091,000","1,118",,97%,,,-,"Centrally located 1929-built residential property with 38 apartments (avg. 68 sqm) and 6 commercial units. Fully let with NOI ~3.1m SEK, strong residential demand. Extensive renovations 2020–2025 (~5.4m SEK invested) and further upside from “Willhemlyft” apartment upgrades.",,,,
338,38,2025/09/16,IM,Projekt Sjöbris,Josefin Bergholtz,Thomas Morne & Ulla-Britt Seymour,Catella,Sweden,Stockholm,Yes,"Torsten Alms gata 47–53, Aspudden",,Tranan 1,Residential,"1,953","1,518","1,894,000",970,,88%,,,-,"Portfolio of two residential properties in Aspudden and Mälarhöjden, Stockholm. Total 46 apartments + 2 commercial units, 2,767 sqm BOA. Combined NOI ~3.2m SEK (2025 fully let). Properties built 1944–49, ongoing renovations, with upside from further apartment refurbishments and attic/basement conversion potential. Short distance to Stockholm CBD (15–18 min).",,,,
338,38,2025/09/16,IM,Projekt Sjöbris,Josefin Bergholtz,Thomas Morne & Ulla-Britt Seymour,Catella,Sweden,Stockholm,Yes,"Brådstupsvägen 19, Mälarhöjden",,Pimpinella 3,Residential,814,"1,746","1,031,000","1,267",,100%,,,-,"Portfolio of two residential properties in Aspudden and Mälarhöjden, Stockholm. Total 46 apartments + 2 commercial units, 2,767 sqm BOA. Combined NOI ~3.2m SEK (2025 fully let). Properties built 1944–49, ongoing renovations, with upside from further apartment refurbishments and attic/basement conversion potential. Short distance to Stockholm CBD (15–18 min).",,,,
339,38,2025/09/17,Teaser,Project Citadel,Carl Rosén,,JLL,Sweden,Stockholm & Gothenburg,Yes,"Ringpärmen 1, Veddesta 2:79, Jordbromalm 6:3/6:20/6:76, Kärra 91:1, Kobbegården 6:136",,Multiple,Logistics,"97,200","1,051",,-,6,96%,,,-,"Portfolio of 5 modern last-mile assets across Stockholm & Gothenburg. Strong covenants with 100% CPI-indexed leases, WAULT 6.2 yrs, occupancy 96%. Reversionary potential >15% and identified development opportunities (e.g. Jordbromalm).",,-,,
340,38,2025/09/17,Teaser,Project Gloss,Kristina Alderin,Provinord A/S / JV Catella & Nordkranen,Catella,Denmark,Glostrup,No,Glosemosevej 20 (Kirkebjerg),2600,Glosemosevej 20,Residential,"22,331","1,920","26,797,200","1,200",,,4.25%,,-,"Large affordable housing project in Glostrup with 205 units (193 apartments + 12 terraced houses), 208 parking spaces. Estimated rent of 1,920 DKK/sqm and target exit yield of 4.25% resi and 4.5% parking. Total project cost ~524m DKK. Construction starts 2026, completion 2028. Catella & Nordkranen managing with RAWO as turnkey contractor.",,,,
341,38,2025/09/18,Teaser,Project Cube (2),Anthony Romano,Kuben Management A/S (subsidiary of NRGi),CBRE,Denmark,Faxe,No,"Rønnede By, V. Egede, 8a & 7c",4683,,Logistics,"130,000",,,-,,,,,-,"Logistics development site in southern Zealand with 130,000 sqm build rights on 260,000sqm land. Located by E47 motorway, ~1h south of Copenhagen. Strategic hub benefiting from 2029 Fehmarn Belt tunnel. Municipality supportive; sustainability focus with solar rooftops.",,,,
342,38,2025/09/18,IM,Guldsmedshyttan,David Hävermark,Baettr Holding GmbH,Access Partners,Sweden,Lindesberg (Örebro County),No,Guldsmedshyttan 57:1,,Guldsmedshyttan 57:1,Industrial,"22,000",,,-,,,,,-,"Historic Swedish iron foundry site closing in Oct 2025. 22,000 sqm production on 440,000 sqm land. Potential for defense industry, industrial park, or data center (7MW power capacity).",,,,
343,38,2025/09/18,Teaser,Gamlestads Smedja,Carl Rosén,PEAB,Catella,Sweden,Gothenburg,No,Gert Tommessonsgata 2,,Göteborg Gamlestaden 80:2,Office ,"12,986","2,932","36,518,000","2,812",7,69%,,,-,"Newly built 2024 office property in Gamlestaden, Gothenburg. Anchored by PEAB, Swisslog, Swedbank, Nordic Wellness, Spaces/IWG, atNorth. PEAB lease guarantee to 95% occupancy. Excellent transport at Gamlestads Torg.",,,,
344,38,2025/09/18,IM,Project Window,Carl Rosén,,Catella,Sweden,Gothenburg,Yes,Johan på Gårdas gata 5,,Gårda 18:25,Office,"17,002","3,582","23,500,000","1,382",3,58%,,,-,"Portfolio of three centrally located office/healthcare assets in Gårda, Gothenburg, totalling 28,112 sqm. Current NOI 40.3m SEK, with potential 78m SEK fully let. Certified LEED Platinum (Gröna Skrapan) and BREEAM (others). Strong connectivity to Ullevi and E6/E20, vacancy upside and stable tenant mix.",,,,
345,38,2025/09/18,IM,Project Window,Carl Rosén,,Catella,Sweden,Gothenburg,Yes,Drakegatan 1 m.fl.,,Gårda 19:7,Office,"7,860","3,142","12,400,000","1,578",3,71%,,,-,"Portfolio of three centrally located office/healthcare assets in Gårda, Gothenburg, totalling 28,112 sqm. Current NOI 40.3m SEK, with potential 78m SEK fully let. Certified LEED Platinum (Gröna Skrapan) and BREEAM (others). Strong connectivity to Ullevi and E6/E20, vacancy upside and stable tenant mix.",,,,
346,38,2025/09/18,IM,Project Window,Carl Rosén,,Catella,Sweden,Gothenburg,Yes,Fabriksgatan 10,,Gårda 18:21,Office,"3,250","3,385","4,400,000","1,354",4,54%,,,-,"Portfolio of three centrally located office/healthcare assets in Gårda, Gothenburg, totalling 28,112 sqm. Current NOI 40.3m SEK, with potential 78m SEK fully let. Certified LEED Platinum (Gröna Skrapan) and BREEAM (others). Strong connectivity to Ullevi and E6/E20, vacancy upside and stable tenant mix.",,,,
347,39,2025/09/19,IM,Projekt Castle (2),Josefin Bergholtz,Steninge Slott Fastighet 38 AB,Novier,Sweden,Sigtuna,Yes,"Steninge slottsväg 145, 147, 149",,"Steninge 1:216, 1:196, 1:133",Residential,"5,178","2,149","8,912,000","1,721",,100%,,,-,"Portfolio of 84 newly built apartments across three properties in Steninge Slottsby, Sigtuna. Delivered in 2023 with investment support and energy bonus, modern heating (geothermal) and solar panels, access to 100 parking spaces with EV charging. Strong rental growth with 10.5% negotiated increases in 2024–25, excellent commuter location close to Märsta, Arlanda, Stockholm, and Uppsala.",,,,
348,39,2025/09/19,Teaser,Project Oak (2),David Hävermark,Ingka Centres Kållered AB,Catella,Sweden,Mölndal,No,Ekenleden 8–12,,Våmmedal 2:158,Retail,"13,370",902,"9,000,000",673,,100%,,,-,"Major retail development opportunity in Kållered, Gothenburg region, adjacent to IKEA. Property includes 4 buildings with tenants like Coop, Systembolaget, Jysk, STC Gym, Kappahl. Current NOI ~9m SEK, with upside to 34.5m SEK upon full redevelopment. Catchment area 528,000 people, strong population growth, 61,500 daily cars on E6. Large zoning plan (18,650 sqm footprint rights) with strategic potential. 70% vacancy expected 2026.",,,,
349,39,2025/09/19,IM,Project Elise (2),Carl Rosén,Famera Fastigheter AB (via Famera Skola 1 AB),JLL,Sweden,Norrtälje,No,Vigelsjövägen 1,761 51,Kungsängsliljan 1,Public use,"5,955","2,547","14,480,000","2,432",18,100%,,,-,"Newly built (2024) school asset fully let to Internationella Engelska Skolan on 18-year CPI-indexed lease. Includes 5,630 sqm school, 325 sqm sports hall, large schoolyard and expansion rights (2,600 sqm GTA). EPC class B, Miljöbyggnad Silver. Strategic location in Norrtälje growth area with strong demand for new schools.",,,,
350,39,2025/09/19,IM,Project Delta (2),David Hävermark,Humlegården Fastigheter AB,Nordanö,Sweden,Stockholm,Yes,Multiple,,"Banvakten, Gelbgjutaren, Instrumentet, Kassaskåpet, Mjölner, Ugnen, Volund, Åldermannen",Residential,"62,062","1,771","41,300,000",665,2,66%,,,-,"Residential portfolio of 8 properties across Stockholm suburbs totaling ~39,000 sqm. Stable NOI of ~61m SEK (2025E) with occupancy ~94%. WAULT ~3.7 years. Diversified tenant base, with upside from rent growth and refurbishments. Efficient management setup through geographically clustered assets.",,,,
351,39,2025/09/19,Teaser,Ejendommen Avedøreholmen 88,Anthony Romano,,,Denmark,Hvidovre,No,Avedøreholmen 88,2650,Avedøreholmen 88,Industrial,"4,600",575,"2,200,000",478,,,,,-,Well-located logistics/industrial property in Hvidovre south of Copenhagen. Fully let to strong covenant tenant with WAULT ~5 years. Info from 2023: stable cash flow with NOI 1.78 MDKK. Part of established logistics cluster near major transport links.,,,,
352,39,2025/09/19,Teaser,Spotorno,Anthony Romano,Spotorno Allé ApS,,Denmark,Taasturp,No,Spotorno Allé 14-34,17028,,Residential,"12,008","1,741","17,550,552","1,462",,,,,-,"Coastal residential project in Liguria with build-out of ~120 holiday apartments across multiple blocks. Attractive seaside location in Spotorno, 60 km from Genoa. NOI potential ~3.8m EUR upon stabilization, with target yield ~5.5%. Development upside and strong demand for second homes in the region.",,,,
353,39,2025/09/19,Teaser,Projekt Falkely,Anthony Romano,Falkely Ejendomme (SPV),Colliers,Denmark,Ishøj,No,Industrivangen 20–26,2635,"Matr. Ishøj By, Ishøj 19fa–19fd",Residential,"9,788","1,924",,-,,,,,-,"Planned residential project with 132 apartments in 4 blocks on a 9,788 sqm site in Ishøj. Location benefits from proximity to S-train, Copenhagen CBD and Øresund corridor. Sustainable design by Mangor & Nagel Arkitekter, delivery post-2026.",,,,
354,39,2025/09/21,Teaser,Project Anchor (2),Anthony Romano,Birch Ejendomme,Cushman & Wakefield,Denmark,"Multiple (Horsens, Aarhus, Ballerup, Ringsted, Køge)",Yes,"Multiple (Naturbyen Nørrestrand, Lunden, Engen, Engkæret, Lautrupvang, Søkæret, Dunbyen Phases 1–2, Trekantgrunden, Nettogrunden)",,Multiple,Residential,"71,901",,,-,,39%,,,-,"Large-scale residential portfolio of 973 units across 5 high-growth municipalities (Greater Copenhagen, Aarhus, Horsens, Ringsted, Køge). Total ~71,900 sqm GFA, average unit size 73.9 sqm. 39% already completed and fully let, remainder under phased delivery 2026–2027. Strong ESG profile with DGNB certification, diversified tenant demand, and potential rental upside.",,,,
355,39,2025/09/22,IM,Project Breeze (2),Filip Gustavsson,Lille Oslo Eiendom AS,Nordanö,Sweden,Burlöv,No,Kronetorps Allé 16–20,232 37,Kronetorp 1:12,Residential,"6,748","2,222","12,463,000","1,847",,100%,,,-,"Newly built (2021) residential property of 115 apartments with total 6,748 sqm.  An estimation of 4.0% for the annual residential rent increase for 2026 Rents ~20–25% below market at SEK 1,984/sqm. EPC rating B, solar panels, efficient FTX system. Prime location between Malmö and Lund, 5 min from Burlöv station with direct rail to Copenhagen. Strong commuter demand and long-term rent uplift potential after subsidy expiry.",,,,
356,39,2025/09/23,IM,Hardemogatan 1,Filip Gustavsson,OSCA Förvaltning Ett AB,Bjurfors Näringsliv,Sweden,Stockholm,No,Hardemogatan 1,124 67,Stockholm Smälleklingan 2,Industrial,"3,583","1,163","2,500,000",698,,100%,,,-,"Fully let industrial/office property opposite the metro; a 1973 building on leasehold land with upgrades (geothermal heating, FTX ventilation) and identified potential for residential development in the block.",,,,
357,39,2025/09/23,IM,Smälleklingan 3,Filip Gustavsson,Dentes Fastighets AB,Länia,Sweden,Stockholm,No,Hardemogatan 3–11,124 67,Stockholm Smälleklingan 3,Industrial,"2,167",729,,-,,,,"  29,000,000 ","13,383","Industrial property with ~1,300 sqm unused building rights and a 130,000 SEK annual leasehold fee; partially let with opportunity to control the entire block together with neighboring Smälleklingan 2.",,,,
358,39,2025/09/24,Teaser,Malmö Hising 8,David Hävermark,Bennfast AB,Catella,Sweden,Malmö,No,Nils Forsbergsgatan 8A–B,,Hising 8,Residential,"2,305","1,851","3,219,000","1,397",,,,,-,1957 apartment building in Slottsstaden (32 units) with central location and stable housing cashflows; noted potential to convert the attic to up to four small apartments. Rental income for 2026 is estimated to reach around SEK 4.3 million and NOI 2026 to reach SEK 3.2 million.,,,,
359,39,2025/09/24,Teaser,Sisjö Entré,Carl Rosén,Union Investment Institutional Property GmbH (via Sisjö Entré Förvaltning AB),Panreal AB,Sweden,Gothenburg,No,Kobbegården 6:8,,Kobbegården 6:8,Retail,"15,310","1,962",,-,4,96%,,,-,"Prime 15,300 sqm retail asset anchored by Rusta, XXL, Arken Zoo in Sisjön retail park. Built 1974/2006 with ~450 parking spaces, strong transport links and catchment area. 90% of rent from A-rated tenants. Rental income 2026E ~30m SEK.",,,,
360,39,2025/09/24,IM,Karlstad Bostäder & Äldreboende,Carl Rosén,Willhem AB & Danaborg AB,Catella,Sweden,Karlstad,Yes,"Fryksdalsgatan 5–9, Mariebergsvägen 26; Sveagatan 10",,Karlstad Liljan 9–11; Karlstad Loke 14,Residential,"4,505","1,641","5,400,000","1,199",,,,,-,"Portfolio of 32 apartments and one elderly care facility (60 beds + 5 apartments) in Karlstad. Central locations in Marieberg and Herrhagen, walking distance to services. Strong tenant covenant with Karlstad municipality for elderly care unit, and popular Willhem-renovated apartments.",,,,
