,Instructions:,,,,,,,,,,,,,,,,,,,,,,,,,,,
111,10,2025/03/04,Lead,Jyderup,Kristina Alderin,,,Denmark,Holbæk,No,Rådbjergvej 4F,4450,,Residential,"15,000",,,-,,,,-,-,"Residential project in Jyderup consisting of c. 165 rowhouses. Building permit is expected in Q3 2025. Trim, the developer, is in negotiations with the land owner to secure an option on the plot. The project will be built in five phases and has an expected completion in Q3 2027.",,,,
112,10,2025/03/04,Lead,Kalundborg III ,Kristina Alderin,,,Denmark,Kalundborg,No,,,,Residential,,,,-,,,,-,-,"Trim, the developer, is in negotiations with the land owner next to the plot we intent to build on in Kalundborg, to see if we can secure additional area. Upon receiving more information we will evaluate the opportunity, taking into considerations that we do not want to be overallocated in one city.",,,,
113,10,2025/03/04,Lead,Helsinge II,Kristina Alderin,,,Denmark,Gribskov,No,Troldemosevej 3,3200,,Residential,"15,000",,,-,,,,-,-,"Residential project in Helsinge. Trim, the developer, is in discussions with Troldeutvikling, option owner. Project will be built in five phases, with the entire project completed as of Q4 2027.",,,,
114,10,2025/03/04,IM,Bavne Ager,Kristina Alderin,OK Fonden,,Denmark,Gribskov,Yes,Bavne Ager,3250,,Public Use,"3,294","1,784","5,037,736","1,529",,,4.26%,"118,300,000","35,914","Project Bavne Ager consists of 42 senior rental apartments designed under the ""Boliger for Livet"" concept, ensuring access to nearby care facilities. The development is located in Gilleleje. The project is being delivered as a turnkey investment.",,,,
115,10,2025/03/05,Lead,LSS,Kristina Alderin,,,Sweden,Southern/central Sweden,Yes,,,,Public Use,"12,500",,,-,10,,,-,-,An LSS opportunity with 20 properties primarily located in southern/central Sweden. Most of the properties are built after 2020. Mainly Humana and Nytida as tenants.,,,,
116,9,2025/02/28,Lead,Skjøde Pipeline,Kristina Alderin,Skjøde,,Denmark,Aarhus,Yes,,,,Residential,"5,400",,,-,,,,"126,500,000","23,426",A project in Aarslev consisting of 68 SFR units. Expected completion in October 2026.,,,,
116,9,2025/02/28,Lead,Skjøde Pipeline,Kristina Alderin,Skjøde,,Denmark,Odense,Yes,,,,Residential,"3,700",,,-,,,,"88,000,000","23,784","A project in Anderup consisting of 47 SFR units. Local plan is expected to be completed in March 2026, and the project has a completion date in June 2027.",,,,
116,9,2025/02/28,Lead,Skjøde Pipeline,Kristina Alderin,Skjøde,,Denmark,Kerteminde,Yes,,,,Public Use,"7,760",,,-,,,,-,-,Nursing home project in Munkebo consisting of 96 units. Expected completion of the project is in April 2027.,,,,
116,9,2025/02/28,Lead,Skjøde Pipeline,Kristina Alderin,Skjøde,,Denmark,Aarhus,Yes,,,,Public Use,"6,316",,,-,,,,-,-,"Nursing home project in Aarhus consisting of 80 units. Local plan is expected to be completed in December 2026, and the construction is expected to be completed in August 2028.",,,,
116,9,2025/02/28,Lead,Skjøde Pipeline,Kristina Alderin,Skjøde,,Denmark,Randers,Yes,,,,Public Use,"7,835",,,-,,,,-,-,Nursing home project in Randers consisting of 80 units. Expected completion in November 2027.,,,,
117,10,2025/03/07,Teaser,Project Grace 3,Annika Fridolf,NCAP/Mitsubishi,JLL,Sweden,Stockholm,No,Sveavägen 34,111 34,,Office,"7,008",,,-,9.2,100%,,-,-,"Project Grace is a fully leased office property situated in central Stockholm, at the intersection of Kungsgatan and Sveavägen. The property's flagship tenant is Sweden’s leading co-working operator, IOffice.",,,,
118,11,2025/03/10,Teaser,Project Green Oak,Filip Gustavsson,Trianon,Reagle,Sweden,Stockholm,Yes,Bjursätragatan 8 & 52 A-B,124 62,"Vallhunden 8, Mjölkboden 4, Bäverungen 5",Residential,"3,911",,"6,939,204","1,774",,100%,,-,-,"Project Green Oak is a residential development opportunity in the district of Rågsved, approximately 13 km from central Stockholm. The portfolio consists of three properties. Estimated building rights for further development is estimated to encompass 6,691 sqm.",,,,
119,10,2025/03/08,IM,Helseholmen 1,Anthony Romano,Square Meter,,Denmark,Hvidovre,No,Helseholmen 1,2650,,Logistics,"10,500",,,-,,,,"37,800,000","3,600","Helseholmen 1 is a development opportunity in Avedøre Holme. The land plot spans 15,000 sqm with an assumed 70% density ratio, supporting a mixed-use development of logistics and office space. Holding period is assumed to be four years, with a deal start in July 2025. The expected return is 1.7x MOIC and 24% levered IRR.",,,,
120,11,2025/03/13,IM,Markan 6,Josefin Bergholtz,Heba Fastighets AB,Catella,Sweden,Täby,No,Flygvilleslingan 10-22,183 60,Markan 6,Residential,"2,848","2,327","5,023,150","1,764",,100%,,-,-,"Markan 6 is a residential property located in Hägernäs, Täby, consisting of four buildings with a total of 52 apartments. The property was built in 2010 and has a site area of 12,658 sqm. ",,,,
121,11,2025/03/14,IM,Petuniahaven,Anthony Romano,"Egetbo Invest ApS, Brudebakke Holding ApS",Colliers,Denmark,Aalborg,No,"	Petuniahaven 18, Nielsmindevej 54",9210,Petuniaparken ApS	,Residential,"5,160","1,334","5,848,327","1,133",,,4.66%,"125,500,000","24,322","Petuniaparken is a newly developed residential project in Aalborg SØ, consisting of 48 single-story row houses and semi-detached houses. The project is divided into two phases, with the first phase expected to be completed by the end of 2025 and the second by late 2026. ",,,,
122,11,2025/03/14,Teaser,Sundheden,Anthony Romano,TN Udvikling A/S,,Denmark,Aalborg,No,	Alfred Nobels Vej,9220,,Residential,"29,600",,,-,,,,-,-,"Sundheden is a development project in Aalborg Ø, located next to the upcoming University Hospital and Aalborg University. The project consists of 14,100 sqm of residential properties, and 15,500 sqm of commercial spaces. ",,,,
123,11,2025/03/11,Teaser,Datacenter,Anthony Romano,RCON A/S,HOF Development,Denmark,Aalborg,No,Loftbrovej,,,Data center,"211,345",,,-,,,,-,-,"A large-scale development opportunity with zoning in progress and power infrastructure upgrades planned. The site benefits from proximity to a 150kV substation. Currently, the zoning process is ongoing with the local plan being prepared and expected to be finalised by 2025. Supply capacity up to 250 MW from Q2 2027. ",,,,
124,12,2025/03/17,Teaser,Project Luna Växjö,David Hävermark,Walter Fastigheter,Nordanö,Sweden,Växjö,No,,,"Legenden 1, Badhuset 1",Hotel,"12,860","1,300",,-,10,100%,,-,-,Fully leased hotel and concert hall. Elite Hotels and Växjö Municipality are the long-term anchor tenants with fixed CPI-linked rents.,,,,
125,12,2025/03/17,Teaser,Project Luna Karlstad,David Hävermark,Nordika Fastigheter,Nordanö,Sweden,Karlstad,No,,,Hyttan 12 & 16,Public Use,"19,400","2,100",,-,9,100%,,-,-,"Cultural, congress, and conference facility in Karlstad. Fully leased to publicly backed tenants, including Karlstad Municipality and the Swedish Consumer Agency. Development potential, including 9,500 sqm of  building rights.",,,,
126,12,2025/03/18,Teaser,Skanska projects,Josefin Bergholtz,Skanska,Cushman & Wakefield,Sweden,Stockholm,Yes,Barkarby,,,Residential,"6,040",,,-,,,,-,-,"Skanska’s portfolio consists of three residential projects in Stockholm, Göteborg, and Helsingborg. Possible to bid on the whole portfolio or in parts. ",,,,
126,12,2025/03/18,Teaser,Skanska projects,Josefin Bergholtz,Skanska,Cushman & Wakefield,Sweden,Gothenburg,Yes,St Jörgen,,,Residential,"5,630",,,-,,,,-,-,"Skanska’s portfolio consists of three residential projects in Stockholm, Göteborg, and Helsingborg. Possible to bid on the whole portfolio or in parts. ",,,,
126,12,2025/03/18,Teaser,Skanska projects,Josefin Bergholtz,Skanska,Cushman & Wakefield,Sweden,Helsingborg,Yes,Fredriksdal,,,Residential,"3,060",,,-,,,,-,-,"Skanska’s portfolio consists of three residential projects in Stockholm, Göteborg, and Helsingborg. Possible to bid on the whole portfolio or in parts. ",,,,
127,12,2025/03/18,Teaser,Tingberget,Josefin Bergholtz,,Cushman & Wakefield,Sweden,Kungsbacka,No,,,,Residential,"19,500",,,-,,,,-,-,"Tingberget is a large-scale residential property located in Kungsbacka, with a walking distance to rail connections. The property consists of 295 apartments, and additional development rights for expansion.",,,,
128,12,2025/03/18,IM,Englandsvej 384,Anthony Romano,Ejendommen Englandsvej 384 ApS,Colliers,Denmark,Tårnby,No,Englandsvej 38,2770,"3cp, Løjtegård, Tårnby",Industrial,"1,119",906,"981,992",878,1,100%,5.78%,"17,500,000","15,639","The property consists of two buildings, constructed in 1969 and 2000, with mixed office, workshop, and showroom spaces. The current tenant, Quickpoint A/S, is responsible for operating expenses. ",,,,
129,12,2025/03/19,IM,Project Hamlet 2,Anthony Romano,"Tristan Capital Partners, Aveca AB",Colliers,Denmark,Høje-Taastrup,Yes,Baldersbuen 1-3,2640,Hedehusene I,Warehouse,"6,920",659,"4,136,821",598,10,100%,,-,-,"Project Hamlet is a last-mile logistics portfolio in Denmark, featuring 12 assets across the Capital Region and Triangle Region. The portfolio has a strong tenant mix, high occupancy, and an ESG roadmap aimed at long-term sustainability improvements. ",,,,
129,12,2025/03/19,IM,Project Hamlet 2,Anthony Romano,"Tristan Capital Partners, Aveca AB",Colliers,Denmark,Høje-Taastrup,Yes,Hedelykken 12,2640,Hedehusene II,Warehouse,"7,059",594,"3,652,534",517,7,100%,,-,-,"Project Hamlet is a last-mile logistics portfolio in Denmark, featuring 12 assets across the Capital Region and Triangle Region. The portfolio has a strong tenant mix, high occupancy, and an ESG roadmap aimed at long-term sustainability improvements. ",,,,
129,12,2025/03/19,IM,Project Hamlet 2,Anthony Romano,"Tristan Capital Partners, Aveca AB",Colliers,Denmark,Rudersdal,Yes,Klintehøj Vænge 8-12,3460,Birkerød,Warehouse,"9,381",543,"3,648,526",389,7,100%,,-,-,"Project Hamlet is a last-mile logistics portfolio in Denmark, featuring 12 assets across the Capital Region and Triangle Region. The portfolio has a strong tenant mix, high occupancy, and an ESG roadmap aimed at long-term sustainability improvements. ",,,,
129,12,2025/03/19,IM,Project Hamlet 2,Anthony Romano,"Tristan Capital Partners, Aveca AB",Colliers,Denmark,Roskilde,Yes,Langebjerg 3,4000,Roskilde,Warehouse,"10,551",654,"5,771,221",547,3,100%,,-,-,"Project Hamlet is a last-mile logistics portfolio in Denmark, featuring 12 assets across the Capital Region and Triangle Region. The portfolio has a strong tenant mix, high occupancy, and an ESG roadmap aimed at long-term sustainability improvements. ",,,,
129,12,2025/03/19,IM,Project Hamlet 2,Anthony Romano,"Tristan Capital Partners, Aveca AB",Colliers,Denmark,Greve,Yes,Roskildevej 16,4030,Tune,Warehouse,"7,994",636,"4,418,880",553,3,82%,,-,-,"Project Hamlet is a last-mile logistics portfolio in Denmark, featuring 12 assets across the Capital Region and Triangle Region. The portfolio has a strong tenant mix, high occupancy, and an ESG roadmap aimed at long-term sustainability improvements. ",,,,
129,12,2025/03/19,IM,Project Hamlet 2,Anthony Romano,"Tristan Capital Partners, Aveca AB",Colliers,Denmark,Slagelse,Yes,Trafikcenter Allé 19-27,4200,Slagelse I,Warehouse,"10,339",410,"3,707,771",359,2,100%,,-,-,"Project Hamlet is a last-mile logistics portfolio in Denmark, featuring 12 assets across the Capital Region and Triangle Region. The portfolio has a strong tenant mix, high occupancy, and an ESG roadmap aimed at long-term sustainability improvements. ",,,,
129,12,2025/03/19,IM,Project Hamlet 2,Anthony Romano,"Tristan Capital Partners, Aveca AB",Colliers,Denmark,Slagelse,Yes,Trafikcenter Allé 30,4200,Slagelse II,Warehouse,"6,911",392,"2,396,476",347,1,100%,,-,-,"Project Hamlet is a last-mile logistics portfolio in Denmark, featuring 12 assets across the Capital Region and Triangle Region. The portfolio has a strong tenant mix, high occupancy, and an ESG roadmap aimed at long-term sustainability improvements. ",,,,
129,12,2025/03/19,IM,Project Hamlet 2,Anthony Romano,"Tristan Capital Partners, Aveca AB",Colliers,Denmark,Roskilde,Yes,Egegårdsvej 9,4621,Gadstrup,Warehouse,"3,922",773,"2,434,318",621,8,100%,,-,-,"Project Hamlet is a last-mile logistics portfolio in Denmark, featuring 12 assets across the Capital Region and Triangle Region. The portfolio has a strong tenant mix, high occupancy, and an ESG roadmap aimed at long-term sustainability improvements. ",,,,
129,12,2025/03/19,IM,Project Hamlet 2,Anthony Romano,"Tristan Capital Partners, Aveca AB",Colliers,Denmark,Kolding,Yes,Kobbervej 5-7,6000,Kolding,Warehouse,"6,645",372,"2,181,096",328,1,100%,,-,-,"Project Hamlet is a last-mile logistics portfolio in Denmark, featuring 12 assets across the Capital Region and Triangle Region. The portfolio has a strong tenant mix, high occupancy, and an ESG roadmap aimed at long-term sustainability improvements. ",,,,
129,12,2025/03/19,IM,Project Hamlet 2,Anthony Romano,"Tristan Capital Partners, Aveca AB",Colliers,Denmark,Kolding,Yes,Kærmindevej 1,6580,Vamdrup,Warehouse,"7,758",250,"1,641,318",212,2,100%,,-,-,"Project Hamlet is a last-mile logistics portfolio in Denmark, featuring 12 assets across the Capital Region and Triangle Region. The portfolio has a strong tenant mix, high occupancy, and an ESG roadmap aimed at long-term sustainability improvements. ",,,,
129,12,2025/03/19,IM,Project Hamlet 2,Anthony Romano,"Tristan Capital Partners, Aveca AB",Colliers,Denmark,Fredericia,Yes,Nordre Kobbelvej 10,7000,Fredericia,Warehouse,"23,426",323,"6,050,295",258,2,74%,,-,-,"Project Hamlet is a last-mile logistics portfolio in Denmark, featuring 12 assets across the Capital Region and Triangle Region. The portfolio has a strong tenant mix, high occupancy, and an ESG roadmap aimed at long-term sustainability improvements. ",,,,
129,12,2025/03/19,IM,Project Hamlet 2,Anthony Romano,"Tristan Capital Partners, Aveca AB",Colliers,Denmark,Hedensted,Yes,Vejlevej 21,8722,Hedensted,Warehouse,"15,429",312,"4,161,947",270,1,77%,,-,-,"Project Hamlet is a last-mile logistics portfolio in Denmark, featuring 12 assets across the Capital Region and Triangle Region. The portfolio has a strong tenant mix, high occupancy, and an ESG roadmap aimed at long-term sustainability improvements. ",,,,
130,12,2025/03/20,IM,Project Kvarts,Simon Klinga,Å Tilder Fastighetsaktiebolag,Croisette,Sweden,Järfälla,No,Bruttovägen 8A,175 43,Veddesta 5:13,Light industrial,"1,830","1,461","2,421,000","1,323",5,100%,,-,-,"Project Kvarts is a fully let light-industrial property located in Veddesta, Järfälla, within Stockholm County. The property has a WAULT of 4.6 years and is leased to three tenants operating in metalwork, manufacturing, and industrial innovation.",,,,
131,12,2025/03/20,Teaser,Project Runway,Mathias Vuorelma,,Cushman & Wakefield,Finland,Turku,No,,,,Logistics,"9,000",,"900,000",100,4,100%,,-,-,"The property is the only cargo terminal at Turku Airport, anchored by FedEx and DHL. It is situated in a strategic airside location with no comparable alternatives nearby. It underpins critical air freight operations in southwestern Finland.",,,,
132,12,2025/03/21,Teaser,Timotejen 20,Josefin Bergholtz,Veraz Holding,Nordanö,Sweden,Stockholm,No,Tellusborgsvägen 67,126 29,Timotejen 20,Office,"9,200","2,609",,-,3,90%,,-,-,"Timotejen 20 is an office property in Telefonplan, Stockholm, originally built in 1913 and later transformed into office spaces. Stockholm city center ia a 15-min drive away. It is anchored by Stockholm Municipality, contributing 15% of rental income.",,,,
133,12,2025/03/21,IM,Tingseken,Josefin Bergholtz,,Arctic Securities,Sweden,Botkyrka,No,,,Byamannen 2,Residential,"10,366","3,464","31,602,277","3,049",,100%,,-,-,"Byamannen 2 is a residential property in Botkyrka, south of Stockholm, consisting of six buildings with 246 apartments and 43 parking spaces. Completed in 2019/2020 by Titania. The property has received multiple awards for sustainability and residential development.",,,,
134,13,2025/03/24,IM,Naverland 26 II,Anthony Romano,,Andersen Erhverv,Denmark,Glostrup,No,Naverland 26,2600,"Herstedøster By, Herstedøster, 7az",Logistics,"3,272",606,"1,685,512",515,2,100%,7%,"25,000,000","7,641","Naverland 26 is a fully leased investment property in Glostrup, Denmark, situated on a 7,000 sqm plot with three buildings, two of which are occupied by the seller. The site includes a historical trichloroethylene contamination from the 1950s, with remediation costs covered by the regional environmental authorities.",,,,
135,13,2025/03/24,IM,Project Sigvid,Filip Gustavsson,"Mava Fastigheter, Lars Andersson",Svefa,Sweden,Malmö,Yes,,,Dungen 6,Residential,"2,496","1,419","2,312,000",926,,92%,,-,-,"Project Sigvid consists of 10 residential properties located in Södra Sofielund, Malmö, with a total of 172 apartments and six commercial units. The properties are well-connected, situated near public transportation and within cycling distance of Triangeln station. The portfolio offers potential for value-add opportunities, including attic conversions and optimization of vacant spaces.",,,,
135,13,2025/03/24,IM,Project Sigvid,Filip Gustavsson,"Mava Fastigheter, Lars Andersson",Svefa,Sweden,Malmö,Yes,,,Frukten 1,Residential,"1,097","1,409","1,007,000",918,,93%,,-,-,"Project Sigvid consists of 10 residential properties located in Södra Sofielund, Malmö, with a total of 172 apartments and six commercial units. The properties are well-connected, situated near public transportation and within cycling distance of Triangeln station. The portfolio offers potential for value-add opportunities, including attic conversions and optimization of vacant spaces.",,,,
135,13,2025/03/24,IM,Project Sigvid,Filip Gustavsson,"Mava Fastigheter, Lars Andersson",Svefa,Sweden,Malmö,Yes,,,Frukten 4,Residential,"1,237","1,541","1,334,000","1,078",,100%,,-,-,"Project Sigvid consists of 10 residential properties located in Södra Sofielund, Malmö, with a total of 172 apartments and six commercial units. The properties are well-connected, situated near public transportation and within cycling distance of Triangeln station. The portfolio offers potential for value-add opportunities, including attic conversions and optimization of vacant spaces.",,,,
135,13,2025/03/24,IM,Project Sigvid,Filip Gustavsson,"Mava Fastigheter, Lars Andersson",Svefa,Sweden,Malmö,Yes,,,Frukten 9,Residential,871,"1,783","1,131,000","1,299",,100%,,-,-,"Project Sigvid consists of 10 residential properties located in Södra Sofielund, Malmö, with a total of 172 apartments and six commercial units. The properties are well-connected, situated near public transportation and within cycling distance of Triangeln station. The portfolio offers potential for value-add opportunities, including attic conversions and optimization of vacant spaces.",,,,
135,13,2025/03/24,IM,Project Sigvid,Filip Gustavsson,"Mava Fastigheter, Lars Andersson",Svefa,Sweden,Malmö,Yes,,,Grunden 3,Residential,616,"1,469","620,000","1,006",,100%,,-,-,"Project Sigvid consists of 10 residential properties located in Södra Sofielund, Malmö, with a total of 172 apartments and six commercial units. The properties are well-connected, situated near public transportation and within cycling distance of Triangeln station. The portfolio offers potential for value-add opportunities, including attic conversions and optimization of vacant spaces.",,,,
135,13,2025/03/24,IM,Project Sigvid,Filip Gustavsson,"Mava Fastigheter, Lars Andersson",Svefa,Sweden,Malmö,Yes,,,Grunden 5,Residential,"1,329","1,447","1,358,000","1,022",,100%,,-,-,"Project Sigvid consists of 10 residential properties located in Södra Sofielund, Malmö, with a total of 172 apartments and six commercial units. The properties are well-connected, situated near public transportation and within cycling distance of Triangeln station. The portfolio offers potential for value-add opportunities, including attic conversions and optimization of vacant spaces.",,,,
135,13,2025/03/24,IM,Project Sigvid,Filip Gustavsson,"Mava Fastigheter, Lars Andersson",Svefa,Sweden,Malmö,Yes,,,Grunden 9,Residential,"1,837","1,461","1,913,000","1,041",,100%,,-,-,"Project Sigvid consists of 10 residential properties located in Södra Sofielund, Malmö, with a total of 172 apartments and six commercial units. The properties are well-connected, situated near public transportation and within cycling distance of Triangeln station. The portfolio offers potential for value-add opportunities, including attic conversions and optimization of vacant spaces.",,,,
135,13,2025/03/24,IM,Project Sigvid,Filip Gustavsson,"Mava Fastigheter, Lars Andersson",Svefa,Sweden,Malmö,Yes,,,Grunden 10,Residential,"1,262","1,565","1,410,000","1,117",,100%,,-,-,"Project Sigvid consists of 10 residential properties located in Södra Sofielund, Malmö, with a total of 172 apartments and six commercial units. The properties are well-connected, situated near public transportation and within cycling distance of Triangeln station. The portfolio offers potential for value-add opportunities, including attic conversions and optimization of vacant spaces.",,,,
135,13,2025/03/24,IM,Project Sigvid,Filip Gustavsson,"Mava Fastigheter, Lars Andersson",Svefa,Sweden,Malmö,Yes,,,Jordlotten 1,Residential,"1,216","1,411","1,242,000","1,021",,100%,,-,-,"Project Sigvid consists of 10 residential properties located in Södra Sofielund, Malmö, with a total of 172 apartments and six commercial units. The properties are well-connected, situated near public transportation and within cycling distance of Triangeln station. The portfolio offers potential for value-add opportunities, including attic conversions and optimization of vacant spaces.",,,,
135,13,2025/03/24,IM,Project Sigvid,Filip Gustavsson,"Mava Fastigheter, Lars Andersson",Svefa,Sweden,Malmö,Yes,,,Jordlotten 8,Residential,"1,483","1,370","1,351,000",911,,95%,,-,-,"Project Sigvid consists of 10 residential properties located in Södra Sofielund, Malmö, with a total of 172 apartments and six commercial units. The properties are well-connected, situated near public transportation and within cycling distance of Triangeln station. The portfolio offers potential for value-add opportunities, including attic conversions and optimization of vacant spaces.",,,,
136,12,2025/03/18,IM,Bostäder i Älmhult,Filip Gustavsson,J & S Fastigheter i Sverige AB,PwC,Sweden,Älmhult,Yes,Vallgatan 15 A-G,343 34,"Sunnerbo 1, Sunnerbo 2, Gymnasten 6, Uttern 1",Residential,"4,373","1,298","3,597,000",823,,,,-,-,"Consists of four residential properties in Älmhult. The properties are well-maintained, featuring modern heating systems and low vacancy rates.",,,,
137,13,2025/03/24,IM,Project Proxima,Simon Klinga,Evolv Fastigheter Core Holding 3 AB,Croisette,Sweden,Upplands-Bro,Yes,Energivägen 13,196 37,Viby 19:107,Logistics,"8,465","1,634","12,600,000","1,488",5,100%,,-,-,Two properties in prime logistics areas with easy access to major highways and transport nodes. They were completed in 2022. ,,,,
137,13,2025/03/24,IM,Project Proxima,Simon Klinga,Evolv Fastigheter Core Holding 3 AB,Croisette,Sweden,Härryda,Yes,Industrivägen 24,438 92,Assmundtorp 2:152,Logistics,"4,661","1,271","5,600,000","1,201",7,100%,,-,-,Two properties in prime logistics areas with easy access to major highways and transport nodes. They were completed in 2022. ,,,,
138,13,2025/03/25,Teaser,Kilen 4,Josefin Bergholtz,,Catella,Sweden,Stockholm,No,Wallingatan 44,111 24,Kilen 4,Residential,"2,731","2,051",,-,,,,-,-,"Located at Norra Bantorget in central Stockholm, comprising 23 residential apartments and six commercial units. The property offers a total leasable area of 2,731 sqm, with a significant portion dedicated to residential use.",,,,
139,13,2025/03/25,Teaser,Project Aura 2,Mathias Vuorelma,,Newsec Advisory Finland Oy,Finland,Turku,Yes,Ruissalontie 17,20200,As Oy Turun Ruissalontie 17A & 17B,Residential,"3,669",,"830,000",226,,99%,,-,-,"Residential investment opportunity located near Turku CBD, featuring two apartment buildings completed in 2023. The properties are equipped with sustainable features such as solar panels.",,,,
140,13,2025/03/27,IM,SFR Vallentuna & Norrtälje,Erik Widmark,Obos,Preservia,Sweden,Vallentuna,Yes,,,,Residential,"7,490","2,506","17,664,627","2,358",,,5.38%,"328,062,000","43,800","Forward purchase deal presented to us by Preservia. Two SFR projects (to be developed and sold by Obos) with an expected completion in Q1 2027. The deal value of 38,559 SEK/sqm includes financing costs. ",,,,
140,13,2025/03/27,IM,SFR Vallentuna & Norrtälje,Erik Widmark,Obos,Preservia,Sweden,Norrtälje,Yes,,,,Residential,"10,700","2,269","21,073,636","1,969",,,5.64%,"373,333,694","34,891","Forward purchase deal presented to us by Preservia. Two SFR projects (to be developed and sold by Obos) with an expected completion in Q1 2027. The deal value of 38,559 SEK/sqm includes financing costs. ",,,,
141,13,2025/03/26,Teaser,SLK Portfolio,Kristina Alderin,SLK,,Denmark,Various,Yes,,,,Residential,"1,760","1,122",,-,,,5.00%,"34,866,629","19,811","The SLK Portfolio comprises six properties across Denmark, primarily consisting of townhouses. One of the properties is a residential care institution.",,,,
141,13,2025/03/26,Teaser,SLK Portfolio,Kristina Alderin,SLK,,Denmark,Various,Yes,,,,Residential,"3,294","1,784",,-,,,4.50%,"114,394,032","34,728","The SLK Portfolio comprises six properties across Denmark, primarily consisting of townhouses. One of the properties is a residential care institution.",,,,
141,13,2025/03/26,Teaser,SLK Portfolio,Kristina Alderin,SLK,,Denmark,Various,Yes,,,,Residential,"7,845","1,272",,-,,,4.50%,"190,560,280","24,291","The SLK Portfolio comprises six properties across Denmark, primarily consisting of townhouses. One of the properties is a residential care institution.",,,,
